[
  {
    "flight_id": "CT-FL-001",
    "airline": "Contoso Skyways",
    "origin": "Seattle",
    "destination": "Paris",
    "departure_date": "2025-08-15",
    "departure_time": "08:30",
    "arrival_time": "04:30+1",
    "price_usd": "750.00",
    "cabin_class": "Economy",
    "available_seats": "42"
  },
  {
    "flight_id": "CT-FL-002",
    "airline": "Contoso Skyways",
    "origin": "Seattle",
    "destination": "Paris",
    "departure_date": "2025-08-15",
    "departure_time": "14:00",
    "arrival_time": "10:00+1",
    "price_usd": "1450.00",
    "cabin_class": "Business",
    "available_seats": "12"
  },
  {
    "flight_id": "CT-FL-003",
    "airline": "Contoso Skyways",
    "origin": "Paris",
    "destination": "Seattle",
    "departure_date": "2025-08-22",
    "departure_time": "11:00",
    "arrival_time": "14:00",
    "price_usd": "780.00",
    "cabin_class": "Economy",
    "available_seats": "38"
  },
  {
    "flight_id": "CT-FL-004",
    "airline": "Contoso Skyways",
    "origin": "Paris",
    "destination": "Seattle",
    "departure_date": "2025-08-22",
    "departure_time": "18:00",
    "arrival_time": "21:00",
    "price_usd": "1520.00",
    "cabin_class": "Business",
    "available_seats": "8"
  },
  {
    "flight_id": "CT-FL-005",
    "airline": "Atlantic Jet",
    "origin": "New York",
    "destination": "London",
    "departure_date": "2025-09-01",
    "departure_time": "19:00",
    "arrival_time": "07:00+1",
    "price_usd": "620.00",
    "cabin_class": "Economy",
    "available_seats": "55"
  },
  {
    "flight_id": "CT-FL-006",
    "airline": "Atlantic Jet",
    "origin": "New York",
    "destination": "London",
    "departure_date": "2025-09-01",
    "departure_time": "22:00",
    "arrival_time": "10:00+1",
    "price_usd": "2100.00",
    "cabin_class": "First",
    "available_seats": "4"
  },
  {
    "flight_id": "CT-FL-007",
    "airline": "Atlantic Jet",
    "origin": "London",
    "destination": "New York",
    "departure_date": "2025-09-10",
    "departure_time": "09:00",
    "arrival_time": "12:00",
    "price_usd": "650.00",
    "cabin_class": "Economy",
    "available_seats": "48"
  },
  {
    "flight_id": "CT-FL-008",
    "airline": "Atlantic Jet",
    "origin": "London",
    "destination": "New York",
    "departure_date": "2025-09-10",
    "departure_time": "15:00",
    "arrival_time": "18:00",
    "price_usd": "1380.00",
    "cabin_class": "Business",
    "available_seats": "10"
  },
  {
    "flight_id": "CT-FL-009",
    "airline": "Pacific Wings",
    "origin": "San Francisco",
    "destination": "Tokyo",
    "departure_date": "2025-10-05",
    "departure_time": "13:00",
    "arrival_time": "17:00+1",
    "price_usd": "890.00",
    "cabin_class": "Economy",
    "available_seats": "60"
  },
  {
    "flight_id": "CT-FL-010",
    "airline": "Pacific Wings",
    "origin": "San Francisco",
    "destination": "Tokyo",
    "departure_date": "2025-10-05",
    "departure_time": "23:00",
    "arrival_time": "05:00+2",
    "price_usd": "2450.00",
    "cabin_class": "Business",
    "available_seats": "6"
  },
  {
    "flight_id": "CT-FL-011",
    "airline": "Pacific Wings",
    "origin": "Tokyo",
    "destination": "San Francisco",
    "departure_date": "2025-10-15",
    "departure_time": "10:00",
    "arrival_time": "06:00",
    "price_usd": "920.00",
    "cabin_class": "Economy",
    "available_seats": "52"
  },
  {
    "flight_id": "CT-FL-012",
    "airline": "Pacific Wings",
    "origin": "Tokyo",
    "destination": "San Francisco",
    "departure_date": "2025-10-15",
    "departure_time": "22:00",
    "arrival_time": "18:00",
    "price_usd": "2500.00",
    "cabin_class": "First",
    "available_seats": "3"
  },
  {
    "flight_id": "CT-FL-013",
    "airline": "EuroStar Air",
    "origin": "Chicago",
    "destination": "Rome",
    "departure_date": "2025-11-01",
    "departure_time": "16:00",
    "arrival_time": "08:00+1",
    "price_usd": "710.00",
    "cabin_class": "Economy",
    "available_seats": "45"
  },
  {
    "flight_id": "CT-FL-014",
    "airline": "EuroStar Air",
    "origin": "Chicago",
    "destination": "Rome",
    "departure_date": "2025-11-01",
    "departure_time": "20:00",
    "arrival_time": "12:00+1",
    "price_usd": "1680.00",
    "cabin_class": "Business",
    "available_seats": "9"
  },
  {
    "flight_id": "CT-FL-015",
    "airline": "EuroStar Air",
    "origin": "Rome",
    "destination": "Chicago",
    "departure_date": "2025-11-10",
    "departure_time": "07:00",
    "arrival_time": "12:00",
    "price_usd": "740.00",
    "cabin_class": "Economy",
    "available_seats": "40"
  },
  {
    "flight_id": "CT-FL-016",
    "airline": "EuroStar Air",
    "origin": "Rome",
    "destination": "Chicago",
    "departure_date": "2025-11-10",
    "departure_time": "14:00",
    "arrival_time": "19:00",
    "price_usd": "1700.00",
    "cabin_class": "Business",
    "available_seats": "7"
  },
  {
    "flight_id": "CT-FL-017",
    "airline": "SunBird Airlines",
    "origin": "Denver",
    "destination": "Canc\u00fan",
    "departure_date": "2025-12-20",
    "departure_time": "06:00",
    "arrival_time": "11:30",
    "price_usd": "480.00",
    "cabin_class": "Economy",
    "available_seats": "70"
  },
  {
    "flight_id": "CT-FL-018",
    "airline": "SunBird Airlines",
    "origin": "Denver",
    "destination": "Canc\u00fan",
    "departure_date": "2025-12-20",
    "departure_time": "10:00",
    "arrival_time": "15:30",
    "price_usd": "950.00",
    "cabin_class": "Business",
    "available_seats": "15"
  },
  {
    "flight_id": "CT-FL-019",
    "airline": "SunBird Airlines",
    "origin": "Canc\u00fan",
    "destination": "Denver",
    "departure_date": "2025-12-28",
    "departure_time": "14:00",
    "arrival_time": "18:30",
    "price_usd": "510.00",
    "cabin_class": "Economy",
    "available_seats": "65"
  },
  {
    "flight_id": "CT-FL-020",
    "airline": "SunBird Airlines",
    "origin": "Canc\u00fan",
    "destination": "Denver",
    "departure_date": "2025-12-28",
    "departure_time": "08:00",
    "arrival_time": "12:30",
    "price_usd": "980.00",
    "cabin_class": "Business",
    "available_seats": "11"
  }
]
